{
  "schema_version": 1,
  "message_id": "0192f4b0-1a2b-7c3d-8e4f-5a6b7c8d9e0f",
  "message_type": "project.generation_requested.v1",
  "occurred_at": "2026-10-24T09:30:00.123456Z",
  "correlation_id": "0192f4a9-0000-7aaa-8bbb-cccccccccccc",
  "project_id": "5f0c2a8e-7c1b-4d2e-9a3f-1b2c3d4e5f60",
  "generation_request_id": "0192f4a9-0000-7aaa-8bbb-cccccccccccc",
  "captured_input_hash": "3a7bd3e2360a3d29eea436fcfb7e44c735d117c42d1c1835420b6b9942dd4f1b"
}
